{
  "schema_version": "heimserver-service-gate-derivation-case.v1",
  "case_id": "golden-inconclusive-stale-evidence",
  "description": "Golden case for inconclusive-stale-evidence",
  "inputs": {
    "server_facts_ref": {
      "path": "examples/server-facts/golden-inconclusive-stale-evidence.json",
      "sha256": "81f6d2ac9dac514ca193c45efa5a41e5a4243a7a9e60d2adb1e9403fe1356c4a"
    },
    "expectation_ref": {
      "path": "examples/heimserver-service-expectations/golden-inconclusive-stale-evidence.json",
      "sha256": "4ef0837b5243cb7f2a18c2072690002d93da8845e3ade4f9100699e33547a954"
    },
    "service_evidence_ref": {
      "path": "examples/heimserver-service-evidence/golden-inconclusive-stale-evidence.json",
      "sha256": "786bef3829db7eb16965323ec65c803a34918b08d4ab47987cca659ac06ce9a0"
    }
  },
  "expected_assessment_ref": {
    "path": "examples/heimserver-service-gate-assessments/golden-inconclusive-stale-evidence.json",
    "sha256": "25a061206efce0cce76242ecb7508f228ba813104d3e099020415513c4f5cbc5"
  }
}
