{
  "schema_version": "heimserver-service-gate-derivation-case.v1",
  "case_id": "golden-multi-service-blocked-over-inconclusive",
  "description": "Golden case for multi-service-blocked-over-inconclusive",
  "inputs": {
    "server_facts_ref": {
      "path": "examples/server-facts/golden-multi-service-blocked-over-inconclusive.json",
      "sha256": "81f6d2ac9dac514ca193c45efa5a41e5a4243a7a9e60d2adb1e9403fe1356c4a"
    },
    "expectation_ref": {
      "path": "examples/heimserver-service-expectations/golden-multi-service-blocked-over-inconclusive.json",
      "sha256": "1aca5f92ac9d5047dfc764bbe326bec177683821b739ebefabd9300fbb4945b0"
    },
    "service_evidence_ref": {
      "path": "examples/heimserver-service-evidence/golden-multi-service-blocked-over-inconclusive.json",
      "sha256": "d189d77b1c593cf0e87bf9b4f939e393a39cd4082d96e0e27517ae9b5ba00e6e"
    }
  },
  "expected_assessment_ref": {
    "path": "examples/heimserver-service-gate-assessments/golden-multi-service-blocked-over-inconclusive.json",
    "sha256": "7952cead6e6cff7b3e296fd9052d4d2eed8b965dc7c516b5289886c7afb05a3e"
  }
}
